{"operation":"create","campaign_id":"table","expected_version":0,"campaign":{"name":"Laeral's \"table\" 🐉","ruleset":"5e","description":"Road\\river\nKeep","current_scene":"Tavern","house_rules":{"0":"Rule","1":"Rule","2":"Rule","3":"Rule","4":"Rule","5":"Rule","6":"Rule","7":"Rule","8":"Rule","9":"Rule","10":"Rule","11":"Rule","12":"Rule","13":"Rule","14":"Rule","15":"Rule","16":"Rule","17":"Rule","18":"Rule","19":"Rule","20":"Rule","21":"Rule","22":"Rule","23":"Rule","24":"Rule","25":"Rule","26":"Rule","27":"Rule","28":"Rule","29":"Rule","30":"Rule","31":"Rule","32":"Rule","33":"Rule","34":"Rule","35":"Rule","36":"Rule","37":"Rule","38":"Rule","39":"Rule","40":"Rule","41":"Rule","42":"Rule","43":"Rule","44":"Rule","45":"Rule","46":"Rule","47":"Rule","48":"Rule","49":"Rule","50":"Rule","51":"Rule","52":"Rule","53":"Rule","54":"Rule","55":"Rule","56":"Rule","57":"Rule","58":"Rule","59":"Rule","60":"Rule","61":"Rule","62":"Rule","63":"Rule","64":"Rule","65":"Rule","66":"Rule","67":"Rule","68":"Rule","69":"Rule","70":"Rule","71":"Rule","72":"Rule","73":"Rule","74":"Rule","75":"Rule","76":"Rule","77":"Rule","78":"Rule","79":"Rule","80":"Rule","81":"Rule","82":"Rule","83":"Rule","84":"Rule","85":"Rule","86":"Rule","87":"Rule","88":"Rule","89":"Rule","90":"Rule","91":"Rule","92":"Rule","93":"Rule","94":"Rule","95":"Rule","96":"Rule","97":"Rule","98":"Rule","99":"Rule"}}}
